{
  "$schema": "https://json-schema.org/draft/2020-12/schema",
  "$id": "https://techfleetworks.github.io/skills-and-practices-framework/schema/framework-data/data-types.schema.json",
  "title": "data-types",
  "description": "A record in the data-types dataset of the Skills & Practices Framework. Field names are the framework's own; see schema/context.jsonld for the schema.org / SKOS mapping.",
  "type": "object",
  "required": [
    "slug"
  ],
  "additionalProperties": false,
  "properties": {
    "id": {
      "type": "integer"
    },
    "slug": {
      "type": "string"
    },
    "Data Type Name": {
      "type": "string"
    },
    "Data Type Description": {
      "type": "string"
    },
    "Relationship to Skills": {
      "type": "string"
    },
    "Relationship to Practices": {
      "type": "string"
    },
    "Relationship to Projects": {
      "type": "string"
    },
    "Relationship to Duties": {
      "type": "string"
    },
    "Relationship to Stakeholders": {
      "type": "string"
    },
    "Relationship to Milestones": {
      "type": "string"
    },
    "Relationship to Tools": {
      "type": "string"
    },
    "Relationship to Activities": {
      "type": "string"
    },
    "Relationship to Deliverables": {
      "type": "string"
    },
    "Relationship to Job Functions": {
      "type": "string"
    },
    "Relationship to Job Specializations": {
      "type": "string"
    },
    "Relationship to Company Types": {
      "type": "string"
    },
    "Relationship to Methodologies": {
      "type": "string"
    },
    "Relationship to Workshops": {
      "type": "string"
    },
    "Examples of Skills": {
      "type": "array",
      "items": {
        "type": "object",
        "properties": {
          "slug": {
            "type": "string"
          },
          "label": {
            "type": "string"
          }
        },
        "required": [
          "slug",
          "label"
        ],
        "additionalProperties": false
      }
    },
    "Tech Job Categories": {
      "type": "string"
    },
    "Relationship to Job Industries": {
      "type": "string"
    },
    "Read Me File": {
      "type": "array",
      "items": {
        "type": "object",
        "properties": {
          "name": {
            "type": "string"
          },
          "url": {
            "type": "string"
          }
        },
        "additionalProperties": true
      }
    },
    "Job Functions": {
      "type": "array",
      "items": {
        "type": "object",
        "properties": {
          "slug": {
            "type": "string"
          },
          "label": {
            "type": "string"
          }
        },
        "required": [
          "slug",
          "label"
        ],
        "additionalProperties": false
      }
    },
    "Specializations": {
      "type": "array",
      "items": {
        "type": "object",
        "properties": {
          "slug": {
            "type": "string"
          },
          "label": {
            "type": "string"
          }
        },
        "required": [
          "slug",
          "label"
        ],
        "additionalProperties": false
      }
    },
    "Examples of Practices": {
      "type": "array",
      "items": {
        "type": "object",
        "properties": {
          "slug": {
            "type": "string"
          },
          "label": {
            "type": "string"
          }
        },
        "required": [
          "slug",
          "label"
        ],
        "additionalProperties": false
      }
    },
    "Roles": {
      "type": "array",
      "items": {
        "type": "object",
        "properties": {
          "slug": {
            "type": "string"
          },
          "label": {
            "type": "string"
          }
        },
        "required": [
          "slug",
          "label"
        ],
        "additionalProperties": false
      }
    },
    "Product Milestones": {
      "type": "array",
      "items": {
        "type": "object",
        "properties": {
          "slug": {
            "type": "string"
          },
          "label": {
            "type": "string"
          }
        },
        "required": [
          "slug",
          "label"
        ],
        "additionalProperties": false
      }
    },
    "Tools": {
      "type": "array",
      "items": {
        "type": "object",
        "properties": {
          "slug": {
            "type": "string"
          },
          "label": {
            "type": "string"
          }
        },
        "required": [
          "slug",
          "label"
        ],
        "additionalProperties": false
      }
    },
    "Tasks": {
      "type": "array",
      "items": {
        "type": "object",
        "properties": {
          "slug": {
            "type": "string"
          },
          "label": {
            "type": "string"
          }
        },
        "required": [
          "slug",
          "label"
        ],
        "additionalProperties": false
      }
    },
    "Deliverables": {
      "type": "array",
      "items": {
        "type": "object",
        "properties": {
          "slug": {
            "type": "string"
          },
          "label": {
            "type": "string"
          }
        },
        "required": [
          "slug",
          "label"
        ],
        "additionalProperties": false
      }
    },
    "Work Type": {
      "type": "array",
      "items": {
        "type": "object",
        "properties": {
          "slug": {
            "type": "string"
          },
          "label": {
            "type": "string"
          }
        },
        "required": [
          "slug",
          "label"
        ],
        "additionalProperties": false
      }
    },
    "Agile Methodologies": {
      "type": "array",
      "items": {
        "type": "object",
        "properties": {
          "slug": {
            "type": "string"
          },
          "label": {
            "type": "string"
          }
        },
        "required": [
          "slug",
          "label"
        ],
        "additionalProperties": false
      }
    },
    "Job Industry": {
      "type": "array",
      "items": {
        "type": "object",
        "properties": {
          "slug": {
            "type": "string"
          },
          "label": {
            "type": "string"
          }
        },
        "required": [
          "slug",
          "label"
        ],
        "additionalProperties": false
      }
    },
    "Workshops": {
      "type": "array",
      "items": {
        "type": "object",
        "properties": {
          "slug": {
            "type": "string"
          },
          "label": {
            "type": "string"
          }
        },
        "required": [
          "slug",
          "label"
        ],
        "additionalProperties": false
      }
    },
    "Project Types": {
      "type": "array",
      "items": {
        "type": "object",
        "properties": {
          "slug": {
            "type": "string"
          },
          "label": {
            "type": "string"
          }
        },
        "required": [
          "slug",
          "label"
        ],
        "additionalProperties": false
      }
    }
  }
}