[
  {
    "id": 1,
    "slug": "skills",
    "Data Type Name": "Skills",
    "Data Type Description": "A competency in an area of expertise.",
    "Relationship to Skills": "Skills and other Skills are related in the following ways:\n1. Some skills are prerequisites that people build before they can pick up more advanced skills.\n2. Growing one skill often strengthens the related skills a person already has.",
    "Relationship to Practices": "Skills and Practices are related in the following ways:\n1. People need practices like shared ownership and psychological safety to use their skills well on a team.\n2. Practices shape how a person applies a skill with others, so the same skill lands differently depending on the practices behind it.",
    "Relationship to Projects": "Skills and Projects are related in the following ways:\n1. People use their skills to move a project forward and get the work done.\n2. Projects give people a real place to apply and prove their skills.",
    "Relationship to Duties": "Skills and Duties are related in the following ways:\n1. People need certain skills to take on a duty and handle its responsibilities.\n2. A duty defines which skills a person is expected to bring and keep growing.",
    "Relationship to Stakeholders": "Skills and Stakeholders are related in the following ways:\n1. People use their skills to understand and meet what stakeholders need.\n2. Stakeholders drive the demand for specific skills by shaping what the work requires.",
    "Relationship to Milestones": "Skills and Milestones are related in the following ways:\n1. People must have the right skills to reach a milestone in the work.\n2. Each milestone calls for a particular set of skills before a team can complete it.",
    "Relationship to Tools": "Skills and Tools are related in the following ways:\n1. People rely on their skills to use tools effectively.\n2. Tools extend a person's skills and usually take skill to operate well.",
    "Relationship to Activities": "Skills and Activities are related in the following ways:\n1. People apply their skills to carry out the day-to-day activities of the work.\n2. Doing activities over and over is how people build and sharpen their skills.",
    "Relationship to Deliverables": "Skills and Deliverables are related in the following ways:\n1. People use their skills to create the deliverables a team produces.\n2. Each deliverable calls for specific skills to make it well.",
    "Relationship to Job Functions": "Skills and Job Functions are related in the following ways:\n1. People qualify for a job function by having the skills it calls for.\n2. A job function points to the skills a person is expected to have.",
    "Relationship to Job Specializations": "Skills and Job Specializations are related in the following ways:\n1. A specialization is built on a focused set of skills a person grows deep in.\n2. The skills you choose to sharpen point you toward a specialization.",
    "Relationship to Company Types": "Skills and Company Types are related in the following ways:\n1. The skills a person has help them fit the way different company types work.\n2. Different company types lean on different skills, so the setting shapes which skills matter most.",
    "Relationship to Methodologies": "Skills and Methodologies are related in the following ways:\n1. People apply their skills within a methodology to guide how the work flows.\n2. A methodology calls for certain skills, like facilitation or planning, to run it well.",
    "Relationship to Workshops": "Skills and Workshops are related in the following ways:\n1. People bring and use their skills to take part in workshops.\n2. Workshops are a hands-on way for people to build and practice skills together.",
    "Examples of Skills": [
      {
        "slug": "interviewing",
        "label": "Interviewing"
      },
      {
        "slug": "survey-design",
        "label": "Survey Design"
      },
      {
        "slug": "usability-testing",
        "label": "Usability Testing"
      },
      {
        "slug": "research-facilitation",
        "label": "Research Facilitation"
      },
      {
        "slug": "experiment-design",
        "label": "Experiment Design"
      },
      {
        "slug": "research-analysis",
        "label": "Research Analysis"
      },
      {
        "slug": "affinity-mapping",
        "label": "Affinity Mapping"
      },
      {
        "slug": "problem-statements",
        "label": "Problem Statements"
      },
      {
        "slug": "vision-formation",
        "label": "Vision Formation"
      },
      {
        "slug": "backlog-management",
        "label": "Backlog Management"
      },
      {
        "slug": "kanban-board-management",
        "label": "Kanban Board Management"
      },
      {
        "slug": "requirements-management",
        "label": "Requirements Management"
      },
      {
        "slug": "user-stories",
        "label": "User Stories"
      },
      {
        "slug": "branding",
        "label": "Branding"
      },
      {
        "slug": "interaction-design",
        "label": "Interaction Design"
      },
      {
        "slug": "information-architecture",
        "label": "Information Architecture"
      },
      {
        "slug": "go-to-market-strategy",
        "label": "Go-to-Market Strategy"
      },
      {
        "slug": "customer-experience-strategy",
        "label": "Customer Experience Strategy"
      },
      {
        "slug": "motor-based-accessibility",
        "label": "Motor-Based Accessibility"
      },
      {
        "slug": "gestalt-principles",
        "label": "Gestalt Principles"
      },
      {
        "slug": "design-patterns",
        "label": "Design Patterns"
      },
      {
        "slug": "prototyping",
        "label": "Prototyping"
      },
      {
        "slug": "information-hierarchy",
        "label": "Information Hierarchy"
      },
      {
        "slug": "typography",
        "label": "Typography"
      },
      {
        "slug": "graphic-design",
        "label": "Graphic Design"
      },
      {
        "slug": "contextual-inquiries",
        "label": "Contextual Inquiries"
      },
      {
        "slug": "behavior-driven-development-bdd-scenarios",
        "label": "Behavior Driven Development (BDD) Scenarios"
      },
      {
        "slug": "information-visualization",
        "label": "Information Visualization"
      },
      {
        "slug": "mental-models",
        "label": "Mental Models"
      },
      {
        "slug": "visual-signifiers",
        "label": "Visual Signifiers"
      },
      {
        "slug": "storytelling",
        "label": "Storytelling"
      },
      {
        "slug": "epic-and-feature-management",
        "label": "Epic and Feature Management"
      },
      {
        "slug": "release-management",
        "label": "Release Management"
      },
      {
        "slug": "agile-coaching",
        "label": "Agile Coaching"
      },
      {
        "slug": "velocity-measurement",
        "label": "Velocity Measurement"
      },
      {
        "slug": "ethnography",
        "label": "Ethnography"
      },
      {
        "slug": "public-speaking",
        "label": "Public Speaking"
      },
      {
        "slug": "prioritization",
        "label": "Prioritization"
      },
      {
        "slug": "click-testing",
        "label": "Click Testing"
      },
      {
        "slug": "tree-testing",
        "label": "Tree Testing"
      },
      {
        "slug": "icon-design",
        "label": "Icon Design"
      },
      {
        "slug": "design-systems-management",
        "label": "Design Systems Management"
      },
      {
        "slug": "heuristics",
        "label": "Heuristics"
      },
      {
        "slug": "ai-prompting",
        "label": "AI Prompting"
      },
      {
        "slug": "data-analysis",
        "label": "Data Analysis"
      },
      {
        "slug": "negotiation",
        "label": "Negotiation"
      },
      {
        "slug": "agile-method-selection",
        "label": "Agile Method Selection"
      },
      {
        "slug": "assumption-formation",
        "label": "Assumption Formation"
      },
      {
        "slug": "project-management",
        "label": "Project Management"
      },
      {
        "slug": "meeting-facilitation",
        "label": "Meeting Facilitation"
      },
      {
        "slug": "object-oriented-programming-languages",
        "label": "Object-oriented Programming Languages"
      },
      {
        "slug": "algorithm-design",
        "label": "Algorithm Design"
      },
      {
        "slug": "command-line-scripting-languages",
        "label": "Command Line Scripting Languages"
      },
      {
        "slug": "product-market-fit",
        "label": "Product-Market Fit"
      },
      {
        "slug": "network-architecture",
        "label": "Network Architecture"
      },
      {
        "slug": "information-security",
        "label": "Information Security"
      },
      {
        "slug": "ux-research-method-selection",
        "label": "UX Research Method Selection"
      },
      {
        "slug": "database-architecture",
        "label": "Database Architecture"
      },
      {
        "slug": "service-design",
        "label": "Service Design"
      },
      {
        "slug": "database-management",
        "label": "Database Management"
      },
      {
        "slug": "user-interface-design",
        "label": "User Interface Design"
      },
      {
        "slug": "apis",
        "label": "API's"
      },
      {
        "slug": "agile-ux",
        "label": "Agile UX"
      },
      {
        "slug": "perceptual-based-accessibility",
        "label": "Perceptual-Based Accessibility"
      },
      {
        "slug": "cognitive-based-accessibility",
        "label": "Cognitive-Based Accessibility"
      },
      {
        "slug": "blockchain-programming-languages",
        "label": "Blockchain Programming Languages"
      },
      {